{
  "graph": {
    "edges": [
      {
        "id": "EDGE-ACTOR-GOAL",
        "kind": "initiates",
        "source": "DECLARED",
        "sourceId": "ACTOR-REQUESTER",
        "targetId": "GOAL-GRAPH-DRIVEN-DEVELOPMENT"
      },
      {
        "id": "EDGE-GOAL-FLOW",
        "kind": "contains",
        "source": "DECLARED",
        "sourceId": "GOAL-GRAPH-DRIVEN-DEVELOPMENT",
        "targetId": "FLOW-REQUIREMENT-TO-DEVELOPMENT"
      },
      {
        "id": "EDGE-FLOW-SUBMIT",
        "kind": "contains",
        "source": "DECLARED",
        "sourceId": "FLOW-REQUIREMENT-TO-DEVELOPMENT",
        "targetId": "ACTION-SUBMIT-REQUIREMENT"
      },
      {
        "id": "EDGE-SUBMIT-ANALYZE",
        "kind": "next",
        "source": "DECLARED",
        "sourceId": "ACTION-SUBMIT-REQUIREMENT",
        "targetId": "ACTION-ANALYZE-REQUIREMENT"
      },
      {
        "id": "EDGE-ANALYZE-COMPLETE",
        "kind": "next",
        "source": "DECLARED",
        "sourceId": "ACTION-ANALYZE-REQUIREMENT",
        "targetId": "DECISION-INFORMATION-COMPLETE"
      },
      {
        "id": "EDGE-INCOMPLETE-ASK",
        "kind": "branch",
        "label": "否",
        "source": "DECLARED",
        "sourceId": "DECISION-INFORMATION-COMPLETE",
        "targetId": "ACTION-ASK-QUESTION"
      },
      {
        "id": "EDGE-ASK-SUBMIT",
        "kind": "next",
        "source": "DECLARED",
        "sourceId": "ACTION-ASK-QUESTION",
        "targetId": "ACTION-SUBMIT-REQUIREMENT"
      },
      {
        "id": "EDGE-COMPLETE-GRAPH",
        "kind": "branch",
        "label": "是",
        "source": "DECLARED",
        "sourceId": "DECISION-INFORMATION-COMPLETE",
        "targetId": "ACTION-GENERATE-UNIFIED-GRAPH"
      },
      {
        "id": "EDGE-GRAPH-APPROVE",
        "kind": "next",
        "source": "DECLARED",
        "sourceId": "ACTION-GENERATE-UNIFIED-GRAPH",
        "targetId": "DECISION-APPROVE-UNIFIED-GRAPH"
      },
      {
        "id": "EDGE-REVISE-SUBMIT",
        "kind": "branch",
        "label": "需要修改",
        "source": "DECLARED",
        "sourceId": "DECISION-APPROVE-UNIFIED-GRAPH",
        "targetId": "ACTION-SUBMIT-REQUIREMENT"
      },
      {
        "id": "EDGE-APPROVE-DEVELOP",
        "kind": "branch",
        "label": "批准并开始开发",
        "source": "DECLARED",
        "sourceId": "DECISION-APPROVE-UNIFIED-GRAPH",
        "targetId": "ACTION-DEVELOP-IN-WORKTREE"
      },
      {
        "id": "EDGE-DEVELOP-RESULT",
        "kind": "produces",
        "source": "DECLARED",
        "sourceId": "ACTION-DEVELOP-IN-WORKTREE",
        "targetId": "OUTCOME-DEVELOPMENT-RESULT"
      },
      {
        "id": "EDGE-DEVELOP-APPROVAL-GUARD",
        "kind": "guarded_by",
        "source": "DECLARED",
        "sourceId": "ACTION-DEVELOP-IN-WORKTREE",
        "targetId": "RULE-NO-WRITE-BEFORE-APPROVAL"
      },
      {
        "id": "EDGE-APPROVE-IMMUTABLE-GUARD",
        "kind": "guarded_by",
        "source": "DECLARED",
        "sourceId": "DECISION-APPROVE-UNIFIED-GRAPH",
        "targetId": "RULE-APPROVED-GRAPH-IMMUTABLE"
      },
      {
        "id": "EDGE-FLOW-SCN-DIALOG",
        "kind": "contains",
        "source": "INFERRED",
        "sourceId": "FLOW-REQUIREMENT-TO-DEVELOPMENT",
        "targetId": "SCN-REQ-DIALOG-001"
      },
      {
        "id": "EDGE-FLOW-SCN-DEPENDENCY",
        "kind": "contains",
        "source": "INFERRED",
        "sourceId": "FLOW-REQUIREMENT-TO-DEVELOPMENT",
        "targetId": "SCN-REQ-DEPENDENCY-001"
      },
      {
        "id": "EDGE-FLOW-SCN-GRAPH-LIVE",
        "kind": "contains",
        "source": "INFERRED",
        "sourceId": "FLOW-REQUIREMENT-TO-DEVELOPMENT",
        "targetId": "SCN-GRAPH-LIVE-001"
      },
      {
        "id": "EDGE-FLOW-SCN-GRAPH-EXPLORE",
        "kind": "contains",
        "source": "INFERRED",
        "sourceId": "FLOW-REQUIREMENT-TO-DEVELOPMENT",
        "targetId": "SCN-GRAPH-EXPLORE-001"
      },
      {
        "id": "EDGE-FLOW-SCN-REVISE",
        "kind": "contains",
        "source": "INFERRED",
        "sourceId": "FLOW-REQUIREMENT-TO-DEVELOPMENT",
        "targetId": "SCN-REQ-REVISE-001"
      },
      {
        "id": "EDGE-FLOW-SCN-APPROVE",
        "kind": "contains",
        "source": "INFERRED",
        "sourceId": "FLOW-REQUIREMENT-TO-DEVELOPMENT",
        "targetId": "SCN-REQ-APPROVE-001"
      },
      {
        "id": "EDGE-FLOW-SCN-APPROVE-BLOCK",
        "kind": "contains",
        "source": "INFERRED",
        "sourceId": "FLOW-REQUIREMENT-TO-DEVELOPMENT",
        "targetId": "SCN-REQ-APPROVE-BLOCK-001"
      },
      {
        "id": "EDGE-FLOW-SCN-DEVELOP",
        "kind": "contains",
        "source": "INFERRED",
        "sourceId": "FLOW-REQUIREMENT-TO-DEVELOPMENT",
        "targetId": "SCN-DEV-CODEX-001"
      },
      {
        "id": "EDGE-FLOW-SCN-FAIL",
        "kind": "contains",
        "source": "INFERRED",
        "sourceId": "FLOW-REQUIREMENT-TO-DEVELOPMENT",
        "targetId": "SCN-DEV-FAIL-001"
      },
      {
        "id": "EDGE-FLOW-SCN-QUESTION",
        "kind": "contains",
        "source": "INFERRED",
        "sourceId": "FLOW-REQUIREMENT-TO-DEVELOPMENT",
        "targetId": "SCN-DEV-QUESTION-001"
      },
      {
        "id": "EDGE-SUBMIT-SCREEN",
        "kind": "realized_by",
        "source": "INFERRED",
        "sourceId": "ACTION-SUBMIT-REQUIREMENT",
        "targetId": "DESIGN-SCREEN-CONVERSATION-GRAPH"
      },
      {
        "id": "EDGE-ANALYZE-COORDINATOR",
        "kind": "realized_by",
        "source": "INFERRED",
        "sourceId": "ACTION-ANALYZE-REQUIREMENT",
        "targetId": "DESIGN-COMPONENT-REQUIREMENT-COORDINATOR"
      },
      {
        "id": "EDGE-ANALYZE-CODEX-RUNNER",
        "kind": "realized_by",
        "source": "DERIVED",
        "sourceId": "ACTION-ANALYZE-REQUIREMENT",
        "targetId": "DESIGN-COMPONENT-CODEX-RUNNER"
      },
      {
        "id": "EDGE-ASK-SCREEN",
        "kind": "realized_by",
        "source": "INFERRED",
        "sourceId": "ACTION-ASK-QUESTION",
        "targetId": "DESIGN-SCREEN-CONVERSATION-GRAPH"
      },
      {
        "id": "EDGE-GENERATE-PROJECTION",
        "kind": "realized_by",
        "source": "INFERRED",
        "sourceId": "ACTION-GENERATE-UNIFIED-GRAPH",
        "targetId": "DESIGN-COMPONENT-GRAPH-PROJECTION"
      },
      {
        "id": "EDGE-APPROVE-INTERFACE",
        "kind": "realized_by",
        "source": "INFERRED",
        "sourceId": "DECISION-APPROVE-UNIFIED-GRAPH",
        "targetId": "DESIGN-INTERFACE-APPROVE"
      },
      {
        "id": "EDGE-DEVELOP-WORKTREE-MANAGER",
        "kind": "realized_by",
        "source": "INFERRED",
        "sourceId": "ACTION-DEVELOP-IN-WORKTREE",
        "targetId": "DESIGN-COMPONENT-WORKTREE-MANAGER"
      },
      {
        "id": "EDGE-DEVELOP-CODEX-RUNNER",
        "kind": "realized_by",
        "source": "DERIVED",
        "sourceId": "ACTION-DEVELOP-IN-WORKTREE",
        "targetId": "DESIGN-COMPONENT-CODEX-RUNNER"
      },
      {
        "id": "EDGE-RESULT-STATE-INTERFACE",
        "kind": "realized_by",
        "source": "INFERRED",
        "sourceId": "OUTCOME-DEVELOPMENT-RESULT",
        "targetId": "DESIGN-INTERFACE-STATE"
      },
      {
        "id": "EDGE-SCN-DIALOG-MESSAGE",
        "kind": "realized_by",
        "source": "INFERRED",
        "sourceId": "SCN-REQ-DIALOG-001",
        "targetId": "DESIGN-INTERFACE-MESSAGE"
      },
      {
        "id": "EDGE-SCN-DEPENDENCY-VALIDATOR",
        "kind": "realized_by",
        "source": "INFERRED",
        "sourceId": "SCN-REQ-DEPENDENCY-001",
        "targetId": "DESIGN-COMPONENT-GRAPH-VALIDATOR"
      },
      {
        "id": "EDGE-GRAPH-LIVE-COORDINATOR",
        "kind": "realized_by",
        "source": "INFERRED",
        "sourceId": "SCN-GRAPH-LIVE-001",
        "targetId": "DESIGN-COMPONENT-REQUIREMENT-COORDINATOR"
      },
      {
        "id": "EDGE-GRAPH-EXPLORE-PROJECTION",
        "kind": "realized_by",
        "source": "INFERRED",
        "sourceId": "SCN-GRAPH-EXPLORE-001",
        "targetId": "DESIGN-COMPONENT-GRAPH-PROJECTION"
      },
      {
        "id": "EDGE-SCN-REVISE-COORDINATOR",
        "kind": "realized_by",
        "source": "INFERRED",
        "sourceId": "SCN-REQ-REVISE-001",
        "targetId": "DESIGN-COMPONENT-REQUIREMENT-COORDINATOR"
      },
      {
        "id": "EDGE-SCN-APPROVE-VALIDATOR",
        "kind": "realized_by",
        "source": "INFERRED",
        "sourceId": "SCN-REQ-APPROVE-001",
        "targetId": "DESIGN-COMPONENT-GRAPH-VALIDATOR"
      },
      {
        "id": "EDGE-SCN-APPROVE-REVISION",
        "kind": "realized_by",
        "source": "INFERRED",
        "sourceId": "SCN-REQ-APPROVE-001",
        "targetId": "DESIGN-ENTITY-REVISION"
      },
      {
        "id": "EDGE-SCN-APPROVE-BLOCK-VALIDATOR",
        "kind": "realized_by",
        "source": "INFERRED",
        "sourceId": "SCN-REQ-APPROVE-BLOCK-001",
        "targetId": "DESIGN-COMPONENT-GRAPH-VALIDATOR"
      },
      {
        "id": "EDGE-SCN-DEVELOP-WORKTREE",
        "kind": "realized_by",
        "source": "INFERRED",
        "sourceId": "SCN-DEV-CODEX-001",
        "targetId": "DESIGN-COMPONENT-WORKTREE-MANAGER"
      },
      {
        "id": "EDGE-SCN-FAIL-COORDINATOR",
        "kind": "realized_by",
        "source": "INFERRED",
        "sourceId": "SCN-DEV-FAIL-001",
        "targetId": "DESIGN-COMPONENT-REQUIREMENT-COORDINATOR"
      },
      {
        "id": "EDGE-SCN-QUESTION-SCREEN",
        "kind": "realized_by",
        "source": "INFERRED",
        "sourceId": "SCN-DEV-QUESTION-001",
        "targetId": "DESIGN-SCREEN-CONVERSATION-GRAPH"
      },
      {
        "id": "EDGE-WEB-CONTAINS-COORDINATOR",
        "kind": "contains",
        "source": "INFERRED",
        "sourceId": "DESIGN-COMPONENT-LOCAL-WEB",
        "targetId": "DESIGN-COMPONENT-REQUIREMENT-COORDINATOR"
      },
      {
        "id": "EDGE-WEB-CONTAINS-VALIDATOR",
        "kind": "contains",